### ISSUE TITLE
Upload impossible in bucket root

### ISSUE THREAD

**Issue by vignemail1** [minio/console#2305]
Hi.

Since we upgraded our distributed minio production setup this summer, we can't upload files (`s3.PutObject`) in buckets root or newly created folders in bucket roots using the minio embedded web console.
It is working with Python SDK, GUI and CLI clients but with the console, we have upload errors. It was working fine before the update to v2022-08-22 and v2022-09-07.
It seems the console is trying to make a PUT request like `PUT /bucket-name//file.txt` instead of `PUT /bucket-name/file.txt` . As a result our reverse-proxy automatically fix it (as `PUT /bucket-name/file.txt`) before sending the request to the backends, even before the `RewriteRule ... [P]` rule, which leads to a SignatureDoesNotMatch error from the backend.
Is it a bug in console code? And if anyone has an idea on how to configure Apache not to fix PUT requests, it would be greatly appreciated.

**Comment by vignemail1** [comment]
currently running minio   Version: 2022-09-07T22:25:02Z

Relevant part of our reverse-proxy configuration:

```
<Proxy balancer://http-s3>
    BalancerMember "http://s3-1.domain.tld:9000/" route=s3-1-backend
    BalancerMember "http://s3-2.domain.tld:9000/" route=s3-2-backend
    BalancerMember "http://s3-3.domain.tld:9000/" route=s3-3-backend
    BalancerMember "http://s3-4.domain.tld:9000/" route=s3-4-backend
    ProxySet lbmethod=bybusyness
  </Proxy>

  RewriteCond %{HTTP:Upgrade} !=websocket [NC]
  RewriteRule /(.*)           balancer://http-s3/$1 [P,L]
  ProxyPassReverse /          balancer://http-s3/

  ProxyVia Block
  ProxyRequests off
  ProxyPreserveHost on
```

Reverse-proxy logs when trying to upload:
```
s3.domain.tld:443 aaa.bbb.ccc.139 - - [09/Sep/2022:17:13:30 +0200] "GET /bucket-name/?location= HTTP/1.1" 200 5803 "s3.domain.tld" "MinIO (linux; amd64) minio-go/v7.0.35"
s3.domain.tld:443 aaa.bbb.ccc.139 - - [09/Sep/2022:17:13:30 +0200] "PUT /bucket-name//file.txt HTTP/1.1" 403 825 "s3.domain.tld" "MinIO (linux; amd64) minio-go/v7.0.35"
s3.domain.tld:443 aaa.bbb.ccc.138 - - [09/Sep/2022:17:13:30 +0200] "GET /bucket-name/?location= HTTP/1.1" 200 5803 "s3.domain.tld" "MinIO (linux; amd64) minio-go/v7.0.35"
```

Reverse-proxy logs in debug mode:
```
==> s3.domain.tld_access.log <==
s3.domain.tld:443 aaa.bbb.ccc.138 - - [09/Sep/2022:16:51:25 +0200] "GET /bucket-name/?location= HTTP/1.1" 200 5803 "s3.domain.tld" "MinIO (linux; amd64) minio-go/v7.0.35"
==> s3.domain.tld_error.log <==
[Fri Sep 09 16:51:25.377203 2022] [ssl:debug] [pid 530532:tid 139859897345792] ssl_engine_kernel.c(415): [client aaa.bbb.ccc.138:42118] AH02034: Subsequent (No.2) HTTPS request received for child 66 (server s3.domain.tld:443)
[Fri Sep 09 16:51:25.377271 2022] [authz_core:debug] [pid 530532:tid 139859897345792] mod_authz_core.c(815): [client aaa.bbb.ccc.138:42118] AH01626: authorization result of Require all granted: granted
[Fri Sep 09 16:51:25.377300 2022] [authz_core:debug] [pid 530532:tid 139859897345792] mod_authz_core.c(815): [client aaa.bbb.ccc.138:42118] AH01626: authorization result of <RequireAny>: granted
[Fri Sep 09 16:51:25.377348 2022] [proxy:debug] [pid 530532:tid 139859897345792] proxy_util.c(1343): AH10122: proxy: Entering bybusyness for BALANCER (balancer://http-s3)
[Fri Sep 09 16:51:25.377366 2022] [proxy:debug] [pid 530532:tid 139859897345792] proxy_util.c(1436): AH10123: proxy: bybusyness selected worker "http://s3-2.domain.tld:9000" : busy 0 : lbstatus 200
[Fri Sep 09 16:51:25.377377 2022] [proxy_balancer:debug] [pid 530532:tid 139859897345792] mod_proxy_balancer.c(642): [client aaa.bbb.ccc.138:42118] AH01172: balancer://http-s3: worker (http://s3-2.domain.tld:9000) rewritten to http://s3-2.domain.tld:9000/bucket-name/file.txt, referer: s3.domain.tld
[Fri Sep 09 16:51:25.377401 2022] [proxy:debug] [pid 530532:tid 139859897345792] proxy_util.c(2117): AH00924: worker http://s3-2.domain.tld:9000 shared already initialized
[Fri Sep 09 16:51:25.377423 2022] [proxy:debug] [pid 530532:tid 139859897345792] proxy_util.c(2182): AH00927: initializing worker http://s3-2.domain.tld:9000 local
[Fri Sep 09 16:51:25.377449 2022] [proxy:debug] [pid 530532:tid 139859897345792] proxy_util.c(2213): AH00930: initialized pool in child 530532 for (s3-2.domain.tld) min=0 max=25 smax=25
[Fri Sep 09 16:51:25.377460 2022] [proxy:debug] [pid 530532:tid 139859897345792] mod_proxy.c(1503): [client aaa.bbb.ccc.138:42118] AH01143: Running scheme balancer handler (attempt 0), referer: s3.domain.tld
[Fri Sep 09 16:51:25.377495 2022] [proxy:debug] [pid 530532:tid 139859897345792] proxy_util.c(2531): AH00942: http: has acquired connection for (s3-2.domain.tld)
[Fri Sep 09 16:51:25.377518 2022] [proxy:debug] [pid 530532:tid 139859897345792] proxy_util.c(2587): [client aaa.bbb.ccc.138:42118] AH00944: connecting http://s3-2.domain.tld:9000/bucket-name/file.txt to s3-2.domain.tld:9000, referer: s3.domain.tld
[Fri Sep 09 16:51:25.379104 2022] [proxy:debug] [pid 530532:tid 139859897345792] proxy_util.c(2810): [client aaa.bbb.ccc.138:42118] AH00947: connected /bucket-name/file.txt to s3-2.domain.tld:9000, referer: s3.domain.tld
[Fri Sep 09 16:51:25.379651 2022] [proxy:debug] [pid 530532:tid 139859897345792] proxy_util.c(3276): AH02824: http: connection established with aaa.bbb.ccc.139:9000 (s3-2.domain.tld)
[Fri Sep 09 16:51:25.379734 2022] [proxy:debug] [pid 530532:tid 139859897345792] proxy_util.c(3462): AH00962: http: connection complete to aaa.bbb.ccc.139:9000 (s3-2.domain.tld)
[Fri Sep 09 16:51:25.380843 2022] [proxy:debug] [pid 530532:tid 139859897345792] proxy_util.c(2546): AH00943: http: has released connection for (s3-2.domain.tld)
[Fri Sep 09 16:51:25.380925 2022] [proxy_balancer:debug] [pid 530532:tid 139859897345792] mod_proxy_balancer.c(702): [client aaa.bbb.ccc.138:42118] AH01176: proxy_balancer_post_request for (balancer://http-s3), referer: s3.domain.tld
==> s3.domain.tld_access.log <==
s3.domain.tld:443 aaa.bbb.ccc.138 - - [09/Sep/2022:16:51:25 +0200] "PUT /bucket-name//file.txt HTTP/1.1" 403 825 "s3.domain.tld" "MinIO (linux; amd64) minio-go/v7.0.35"
```

TCPDump capture:
```
16:50:01.125402 IP aaa.bbb.ccc.137.60020 > aaa.bbb.ccc.139.9000: Flags [P.], seq 1:1063, ack 1, win 502, options [nop,nop,TS val 1291762082 ecr 4155816114], length 1062
E..ZG.@.@./..........t#(...................
L.......PUT /bucket-name/file.txt HTTP/1.1
Host: s3.domain.tld
User-Agent: MinIO (linux; amd64) minio-go/v7.0.35
Authorization: AWS4-HMAC-SHA256 Credential=XJC9G4TYWNQ6YWN8WQIT/20220909/us-east-1/s3/aws4_request, SignedHeaders=content-type;host;x-amz-content-sha256;x-amz-date;x-amz-security-token, Signature=dc7291f7b9aad4eabb4acdb5c55a105775749d9f83db5be3d41742a7cb8433db
Content-Type: text/plain
X-Amz-Content-Sha256: UNSIGNED-PAYLOAD
X-Amz-Date: 20220909T144311Z
X-Amz-Security-Token: eyJhbGciOiJIUzUxMiIsInR5cCI6IkpXVCJ9.eyJhY2Nlc3NLZXkiOiJYSkM5RzRUWVdOUTZZV044V1FJVCIsImV4cCI6MTY2MjczNTQ4OSwibGRhcFVzZXIiOiJ1aWQ9c3YsY249dXNlcnMsY249YWNjb3VudHMsZGM9ZGxuLXByb2QsZGM9Y3JpYW5uLGRjPWZyIiwibGRhcFVzZXJuYW1lIjoic3YifQ.zmxWx8WnueFCyABR8vR9_wj5gvOliN-0vux03cqi637KDPRQdiQKdbrQPfGTloeq9clO3YSaJDHr37IiciES1A
Referer: s3.domain.tld
X-Forwarded-For: aaa.bbb.ccc.138
X-Forwarded-Host: s3.domain.tld
X-Forwarded-Server: s3.domain.tld
Content-Length: 17
Connection: Keep-Alive
ceci est un test
16:50:01.125524 IP aaa.bbb.ccc.139.9000 > aaa.bbb.ccc.137.60020: Flags [.], ack 1063, win 501, options [nop,nop,TS val 4155816114 ecr 1291762082], length 0
E..4..@.@.h.........#(.t......!.....R......
....L...
16:50:01.126648 IP aaa.bbb.ccc.139.9000 > aaa.bbb.ccc.137.60020: Flags [P.], seq 1:811, ack 1063, win 501, options [nop,nop,TS val 4155816115 ecr 1291762082], length 810
E..^..@.@.e.........#(.t......!......5.....
....L...HTTP/1.1 403 Forbidden
Accept-Ranges: bytes
Content-Length: 405
Content-Security-Policy: block-all-mixed-content
Content-Type: application/xml
Server: MinIO
Strict-Transport-Security: max-age=31536000; includeSubDomains
Vary: Origin
Vary: Accept-Encoding
X-Amz-Request-Id: 1713384D21055A67
X-Content-Type-Options: nosniff
X-Xss-Protection: 1; mode=block
Date: Fri, 09 Sep 2022 14:43:11 GMT
<?xml version="1.0" encoding="UTF-8"?>
<Error><Code>SignatureDoesNotMatch</Code><Message>The request signature we calculated does not match the signature you provided. Check your key and signing method.</Message><Key>file.txt</Key><BucketName>bucket-name</BucketName><Resource>/bucket-name/file.txt</Resource><RequestId>1713384D21055A67</RequestId><HostId>e8e6d02e-8f3b-4e61-8656-c2dc33ef5af7</HostId></Error>
```

Minio envvars:
```bash
MINIO_ROOT_USER=<redacted>
export MINIO_ROOT_USER
MINIO_ROOT_PASSWORD=<redacted>
export MINIO_ROOT_PASSWORD

MINIO_PROMETHEUS_URL=http://localhost:9090
export MINIO_PROMETHEUS_URL

MINIO_SERVER_URL=https://s3.domain.tld
export MINIO_SERVER_URL

MINIO_BROWSER_REDIRECT_URL=https://s3-console.domain.tld
export MINIO_BROWSER_REDIRECT_URL

MINIO_VOLUMES=http://s3-{1...4}.domain.tld:9000/data{1...4}
export MINIO_VOLUMES

MINIO_API_SELECT_PARQUET=on
export MINIO_API_SELECT_PARQUET

MINIO_ADDRESS=":9000"
export MINIO_ADDRESS
MINIO_CONSOLE_ADDRESS=":9001"
export MINIO_CONSOLE_ADDRESS

MINIO_OPTS=""
export MINIO_OPTS

MINIO_IDENTITY_LDAP_SERVER_ADDR="ipa.domain.tld:389"
export MINIO_IDENTITY_LDAP_SERVER_ADDR

```

**Comment by vignemail1** [comment]
![image](https://user-images.githubusercontent.com/718199/189395425-16c6e694-7bf6-43e2-a87c-9d631cf3123a.jpeg)

**Comment by harshavardhana** [comment]
You basically wrong rules carried over from the past, since Console UI now uses S3 API your existing problem has been exposed.

Your reverse proxy is modifying the HTTP request it is not allowed to tamper with HTTP request so naturally uploads will fail. 

> s3.domain.tld:443 aaa.bbb.ccc.139 - - [09/Sep/2022:17:13:30 +0200] "PUT /bucket-name//file.txt HTTP/1.1" 403 825 "s3.domain.tld" "MinIO (linux; amd64) minio-go/v7.0.35"

This is not allowed you can't cannot change arbitrarily your request resource observe the additional `/` that was used 

> RewriteRule /(.*)           balancer://http-s3/$1 [P,L]

Mostly this is wrong, even if the console uses some extra `/` - you shouldn't be messing around with incoming requests in this manner. Proxy at best is an LB and must be passed through nothing more.  Adding custom rewrite rules in this manner is wrong.

**Comment by vignemail1** [comment]
Sorry but I fail to understand your explanation as `RewriteRule /(.*) balancer://http-s3/$1 [P,L]` is a basic proxying rule with RewriteRule directive and proxy_balancer module. For reminder, `http-s3` is the name of the balancer definition, not a URL rewriting part.

This rule translates `https://s3.domain.tld/some/path/to/object` to `http://s3-X.domain.tld:9000/some/path/to/object`, there is not changes in the URL received at the backend/upstream servers side.

The URL normalization is NOT as result of rewrite/proxy module as far I can tell. 
Running Apache in LogLevel trace8, I see the URL to be normalized by Apache somehow (unknown internal Apache process) BEFORE hitting the rewrite module (details not provided in previous logs sorry). 
```
[Fri Sep 09 21:34:36.101234 2022] [rewrite:trace2] [pid 531439:tid 139859880560384] mod_rewrite.c(480): [client aaa.bbb.ccc.138:45492] aaa.bbb.ccc.138 - - [s3.domain.tld/sid#7f33b3ccebf8][rid#7f33b040e0a0/initial] init rewrite engine with requested uri /bucker-name/file.txt
```
It seems to normalized the URL between the end of ssl module and start of rewrite module.

When requests generates s3.ListObject events, everything is working correctly, the URL is fine so i don't see how the RewriteRule has only an effect when it is a s3.PutObject event.

I also tried with the recommended ProxyPass/ProxyPassReverse way from the documentation and it is not working, same problem.

**Comment by harshavardhana** [comment]
It doesn't matter what is the basic setup for a generic proxying is - you are basically Rewriting incoming traffic this is hardly a requirement for an LB for MinIO and should never be done - doing so simply breaks things from a signature calculation point of view it works with some APIs and not others itself shows how harmful such URL normalization is @vignemail1 

There is no reason to mangle the path resources that are intended directly for MinIO. LB must be simply a pass-through and nothing more. 

> Running Apache in LogLevel trace8, I see the URL to be normalized by Apache somehow (unknown internal Apache process) BEFORE hitting the rewrite module (details not provided in previous logs sorry).

This normalization is unexpected Apache HTTP module must not do that in any situation it is simply an LB nothing more - it shouldn't behave like a router. 

For example, Nginx/Haproxy/Caddy/Traefik doesn't do this at all.  I suspect some poor understanding from Apache HTTP folks or there is a way to ask Apache not to do that. 

This is what is needed 

```
<VirtualHost *:80>
    ServerName example.com
    ErrorLog /var/log/httpd/example.com-error.log
    CustomLog /var/log/httpd/example.com-access.log combined

    ProxyRequests Off
    ProxyVia Block
    ProxyPreserveHost On

    <Proxy *>
         Require all granted
    </Proxy>

    ProxyPass / http://localhost:9000/ nocanon
    ProxyPassReverse / http://localhost:9000/
</VirtualHost>
```

Notice the `nocanon` keyword.

**Comment by harshavardhana** [comment]
FWIW I just added to remove an unnecessary `/` in the beginning of PUT requests.
